{
  "$schema": "https://json-schema.org/draft/2020-12/schema",
  "$id": "work-result.schema.json",
  "title": "ACA orchestration work result",
  "description": "The result owns the observed target identity and one transition snapshot for its bounded output.",
  "type": "object",
  "x-aca-allowed-transitions": {"PLANNED": ["PREFLIGHT", "HARD_GATE", "ABANDONED"], "PREFLIGHT": ["IMPLEMENTING", "HARD_GATE", "BLOCKED", "NOT_AUDITABLE"], "IMPLEMENTING": ["IMPLEMENTED_DRAFT_PR", "HARD_GATE", "BLOCKED"], "IMPLEMENTED_DRAFT_PR": ["AUDITING", "HARD_GATE", "BLOCKED", "NOT_AUDITABLE"], "AUDITING": ["PASS", "PASS_WITH_COMMENTS", "CHANGES_REQUESTED", "BLOCKED", "NOT_AUDITABLE"], "CHANGES_REQUESTED": ["CORRECTING", "HARD_GATE", "ABANDONED"], "CORRECTING": ["REAUDITING", "HARD_GATE", "BLOCKED"], "REAUDITING": ["PASS", "PASS_WITH_COMMENTS", "CHANGES_REQUESTED", "BLOCKED", "NOT_AUDITABLE"], "PASS": ["FAST_TRACK_ELIGIBLE", "HARD_GATE", "READY", "ABANDONED"], "PASS_WITH_COMMENTS": ["FAST_TRACK_ELIGIBLE", "HARD_GATE", "READY", "ABANDONED"], "FAST_TRACK_ELIGIBLE": ["READY", "HARD_GATE", "BLOCKED", "NOT_AUDITABLE"], "HARD_GATE": ["PREFLIGHT", "IMPLEMENTING", "AUDITING", "CORRECTING", "READY", "BLOCKED", "ABANDONED"], "READY": ["MERGED", "HARD_GATE", "BLOCKED", "NOT_AUDITABLE"], "MERGED": ["POST_MERGE_SYNC", "BLOCKED"], "POST_MERGE_SYNC": ["COMPLETED", "BLOCKED"]},
  "additionalProperties": false,
  "required": ["work_id", "role", "result_state", "repository", "branch", "base_sha", "target_sha", "pr_applicable", "scope_observation", "checks", "evidence", "transition", "limitations", "next_work"],
  "properties": {
    "work_id": {"$ref": "#/$defs/workId"},
    "role": {"enum": ["CONTROLLER", "INSTRUCTION_EVIDENCE_AUTHOR", "IMPLEMENTATION", "INDEPENDENT_AUDIT", "CORRECTION", "FRESH_REAUDIT", "HUMAN", "EXTERNAL_SYSTEM"]},
    "result_state": {"$ref": "#/$defs/state"},
    "repository": {"$ref": "#/$defs/repository"},
    "branch": {"$ref": "#/$defs/branch"},
    "base_sha": {"$ref": "#/$defs/commitSha"},
    "target_sha": {"$ref": "#/$defs/commitSha"},
    "pr_applicable": {"type": "boolean"},
    "pr_number": {"$ref": "#/$defs/prNumber"},
    "scope_observation": {"type": "object", "additionalProperties": false, "required": ["allowed_scope_only", "changed_files"], "properties": {"allowed_scope_only": {"type": "boolean"}, "changed_files": {"type": "array", "items": {"type": "string", "pattern": "^(?!/)(?!.*\\.\\.)[A-Za-z0-9._/-]+$"}}}},
    "checks": {"type": "array", "minItems": 1, "items": {"type": "object", "additionalProperties": false, "required": ["name", "status", "evidence_ref"], "properties": {"name": {"type": "string", "minLength": 1}, "status": {"enum": ["PASSED", "FAILED", "NOT_RUN", "NOT_APPLICABLE"]}, "evidence_ref": {"$ref": "#/$defs/evidenceReference"}}}},
    "evidence": {"type": "array", "minItems": 1, "items": {"$ref": "#/$defs/evidenceReference"}},
    "transition": {"$ref": "#/$defs/transition"},
    "limitations": {"type": "array", "items": {"type": "string", "minLength": 1}},
    "next_work": {"$ref": "#/$defs/nextWork"},
    "policy_version": {"type": "string", "minLength": 1},
    "routing": {"type": "object"}
  },
  "allOf": [
    {"if": {"properties": {"pr_applicable": {"const": true}}, "required": ["pr_applicable"]}, "then": {"required": ["pr_number"]}, "else": {"not": {"required": ["pr_number"]}}},
    {"if": {"required": ["policy_version"]}, "then": {"required": ["routing"]}, "else": {"not": {"required": ["routing"]}}},
    {"if": {"properties": {"policy_version": {"const": "aca-ai-model-006-a06-2026-10"}}, "required": ["policy_version"]}, "then": {"properties": {"routing": {"$ref": "#/$defs/currentRouting"}}}, "else": {"properties": {"routing": {"$ref": "#/$defs/routing"}}}}
  ],
  "$defs": {
    "workId": {"type": "string", "pattern": "^[A-Z][A-Z0-9_-]{2,127}$"},
    "state": {"enum": ["PLANNED", "PREFLIGHT", "IMPLEMENTING", "IMPLEMENTED_DRAFT_PR", "AUDITING", "CHANGES_REQUESTED", "CORRECTING", "REAUDITING", "PASS", "PASS_WITH_COMMENTS", "BLOCKED", "NOT_AUDITABLE", "FAST_TRACK_ELIGIBLE", "HARD_GATE", "READY", "MERGED", "POST_MERGE_SYNC", "COMPLETED", "ABANDONED"]},
    "repository": {"type": "string", "minLength": 1, "pattern": "^(?!/)(?!.*://)(?!.*\\.\\.)[A-Za-z0-9._/-]+$"},
    "branch": {"type": "string", "pattern": "^[A-Za-z0-9._/-]+$"},
    "commitSha": {"type": "string", "pattern": "^[0-9a-f]{40,64}$"},
    "prNumber": {"type": "integer", "minimum": 1},
    "evidenceHash": {"type": "string", "pattern": "^[0-9a-f]{64}$"},
    "evidenceReference": {"type": "object", "additionalProperties": false, "required": ["reference", "proves", "observed_at"], "properties": {"reference": {"type": "string", "pattern": "^(?!/)(?!.*://)(?!.*\\.\\.)[A-Za-z0-9._#:/ -]+$"}, "proves": {"type": "string", "minLength": 1}, "observed_at": {"type": "string", "format": "date-time"}}},
    "authorityProofDigest": {"type": "string", "pattern": "^[0-9a-f]{64}$"},
    "correctionHistory": {
      "type": "object",
      "additionalProperties": false,
      "required": ["dispatches", "repeated_material_finding", "unresolved_findings", "evidence_reference"],
      "properties": {
        "dispatches": {"type": "integer", "minimum": 0, "maximum": 3},
        "repeated_material_finding": {"type": "boolean"},
        "unresolved_findings": {"type": "boolean"},
        "evidence_reference": {"$ref": "#/$defs/evidenceReference"}
      }
    },
    "nextWork": {
      "type": "object",
      "additionalProperties": false,
      "required": ["action", "rule"],
      "properties": {
        "action": {"enum": ["NONE", "PROPOSE_ONE_NEW_WORK", "CONTINUE_CAMPAIGN", "HUMAN_GATE"]},
        "rule": {"type": "string", "minLength": 1},
        "proposed_id": {"$ref": "#/$defs/workId"},
        "campaign_id": {"$ref": "#/$defs/workId"},
        "completed_work_id": {"$ref": "#/$defs/workId"},
        "sequence_position": {"type": "integer", "minimum": 2},
        "campaign_record_sha256": {"$ref": "#/$defs/evidenceHash"},
        "terminal_human_gate": {"type": "string", "minLength": 1},
        "authority_proof_sha256": {"$ref": "#/$defs/authorityProofDigest"},
        "correction_history": {"$ref": "#/$defs/correctionHistory"}
      },
      "allOf": [
        {
          "if": {"properties": {"action": {"const": "CONTINUE_CAMPAIGN"}}, "required": ["action"]},
          "then": {"required": ["campaign_id", "completed_work_id", "proposed_id", "sequence_position", "campaign_record_sha256", "terminal_human_gate", "authority_proof_sha256", "correction_history"]}
        },
        {
          "if": {"properties": {"action": {"const": "PROPOSE_ONE_NEW_WORK"}}, "required": ["action"]},
          "then": {"required": ["proposed_id"]}
        }
      ]
    },
    "routing": {"type": "object", "additionalProperties": false, "required": ["profile", "model", "reasoning_effort", "sandbox_mode", "selection_reason", "escalation_criteria"], "properties": {"profile": {"enum": ["reconciliation", "implementation_mechanical", "implementation_standard", "implementation_backend", "architecture", "audit_standard", "implementation_critical", "audit_critical"]}, "model": {"enum": ["gpt-5.6-luna", "gpt-5.6-terra", "gpt-5.6-sol"]}, "reasoning_effort": {"enum": ["low", "medium", "high"]}, "sandbox_mode": {"enum": ["workspace-write", "read-only"]}, "selection_reason": {"type": "string", "minLength": 1}, "escalation_criteria": {"type": "array", "minItems": 1, "items": {"type": "string", "minLength": 1}}}, "oneOf": [{"properties": {"profile": {"const": "reconciliation"}, "model": {"const": "gpt-5.6-luna"}, "reasoning_effort": {"const": "low"}, "sandbox_mode": {"const": "workspace-write"}}}, {"properties": {"profile": {"const": "implementation_mechanical"}, "model": {"const": "gpt-5.6-luna"}, "reasoning_effort": {"const": "medium"}, "sandbox_mode": {"const": "workspace-write"}}}, {"properties": {"profile": {"const": "implementation_standard"}, "model": {"const": "gpt-5.6-luna"}, "reasoning_effort": {"const": "medium"}, "sandbox_mode": {"const": "workspace-write"}}}, {"properties": {"profile": {"const": "implementation_backend"}, "model": {"const": "gpt-5.6-terra"}, "reasoning_effort": {"const": "medium"}, "sandbox_mode": {"const": "workspace-write"}}}, {"properties": {"profile": {"const": "architecture"}, "model": {"const": "gpt-5.6-terra"}, "reasoning_effort": {"const": "high"}, "sandbox_mode": {"const": "read-only"}}}, {"properties": {"profile": {"const": "audit_standard"}, "model": {"const": "gpt-5.6-terra"}, "reasoning_effort": {"const": "medium"}, "sandbox_mode": {"const": "read-only"}}}, {"properties": {"profile": {"const": "implementation_critical"}, "model": {"const": "gpt-5.6-sol"}, "reasoning_effort": {"const": "high"}, "sandbox_mode": {"const": "workspace-write"}}}, {"properties": {"profile": {"const": "audit_critical"}, "model": {"const": "gpt-5.6-sol"}, "reasoning_effort": {"const": "high"}, "sandbox_mode": {"const": "read-only"}}}]},
    "currentRouting": {"type": "object", "additionalProperties": false, "required": ["profile", "model", "reasoning_effort", "sandbox_mode", "selection_reason", "escalation_criteria"], "properties": {"profile": {"enum": ["reconciliation", "implementation_mechanical", "implementation_standard", "implementation_backend", "architecture", "audit_standard", "implementation_critical", "audit_critical"]}, "model": {"enum": ["gpt-6-luna", "gpt-6.1-sol"]}, "reasoning_effort": {"enum": ["low", "medium", "high", "xhigh"]}, "sandbox_mode": {"enum": ["workspace-write", "read-only"]}, "selection_reason": {"type": "string", "minLength": 1}, "escalation_criteria": {"type": "array", "minItems": 1, "items": {"type": "string", "minLength": 1}}}, "oneOf": [{"properties": {"profile": {"const": "reconciliation"}, "model": {"const": "gpt-6-luna"}, "reasoning_effort": {"const": "low"}, "sandbox_mode": {"const": "workspace-write"}}}, {"properties": {"profile": {"const": "implementation_mechanical"}, "model": {"const": "gpt-6-luna"}, "reasoning_effort": {"const": "medium"}, "sandbox_mode": {"const": "workspace-write"}}}, {"properties": {"profile": {"const": "implementation_standard"}, "model": {"const": "gpt-6.1-sol"}, "reasoning_effort": {"const": "medium"}, "sandbox_mode": {"const": "workspace-write"}}}, {"properties": {"profile": {"const": "implementation_backend"}, "model": {"const": "gpt-6.1-sol"}, "reasoning_effort": {"const": "medium"}, "sandbox_mode": {"const": "workspace-write"}}}, {"properties": {"profile": {"const": "architecture"}, "model": {"const": "gpt-6.1-sol"}, "reasoning_effort": {"const": "high"}, "sandbox_mode": {"const": "read-only"}}}, {"properties": {"profile": {"const": "audit_standard"}, "model": {"const": "gpt-6.1-sol"}, "reasoning_effort": {"const": "high"}, "sandbox_mode": {"const": "read-only"}}}, {"properties": {"profile": {"const": "implementation_critical"}, "model": {"const": "gpt-6.1-sol"}, "reasoning_effort": {"const": "high"}, "sandbox_mode": {"const": "workspace-write"}}}, {"properties": {"profile": {"const": "audit_critical"}, "model": {"const": "gpt-6.1-sol"}, "reasoning_effort": {"const": "xhigh"}, "sandbox_mode": {"const": "read-only"}}}]},
    "transition": {
      "description": "Each transition snapshots the work ID, repository identity, evidence, and next permitted action at the time of the state change.",
      "type": "object",
      "additionalProperties": false,
      "required": ["work_id", "recorded_at", "actor_role", "repository", "branch", "base_sha", "target_applicable", "pr_applicable", "from_state", "to_state", "reason", "evidence_refs", "evidence_hashes", "next_permitted_action"],
      "properties": {
        "work_id": {"$ref": "#/$defs/workId"},
        "recorded_at": {"type": "string", "format": "date-time"},
        "actor_role": {"enum": ["CONTROLLER", "INSTRUCTION_EVIDENCE_AUTHOR", "IMPLEMENTATION", "INDEPENDENT_AUDIT", "CORRECTION", "FRESH_REAUDIT", "HUMAN", "EXTERNAL_SYSTEM"]},
        "repository": {"$ref": "#/$defs/repository"},
        "branch": {"$ref": "#/$defs/branch"},
        "base_sha": {"$ref": "#/$defs/commitSha"},
        "target_applicable": {"type": "boolean"},
        "target_sha": {"$ref": "#/$defs/commitSha"},
        "pr_applicable": {"type": "boolean"},
        "pr_number": {"$ref": "#/$defs/prNumber"},
        "from_state": {"$ref": "#/$defs/state"},
        "to_state": {"$ref": "#/$defs/state"},
        "reason": {"type": "string", "minLength": 1},
        "evidence_refs": {"type": "array", "minItems": 1, "items": {"$ref": "#/$defs/evidenceReference"}},
        "evidence_hashes": {"type": "array", "minItems": 1, "items": {"$ref": "#/$defs/evidenceHash"}},
        "next_permitted_action": {"type": "string", "minLength": 1},
        "correction_cycle": {"type": "integer", "minimum": 0, "maximum": 3},
        "authority_proof_sha256": {"$ref": "#/$defs/authorityProofDigest"}
      },
      "allOf": [
        {"if": {"properties": {"target_applicable": {"const": true}}, "required": ["target_applicable"]}, "then": {"required": ["target_sha"]}, "else": {"not": {"required": ["target_sha"]}}},
        {"if": {"properties": {"pr_applicable": {"const": true}}, "required": ["pr_applicable"]}, "then": {"required": ["pr_number"]}, "else": {"not": {"required": ["pr_number"]}}},
        {"if": {"properties": {"to_state": {"const": "CORRECTING"}}, "required": ["to_state"]}, "then": {"required": ["correction_cycle"]}},
        {"if": {"properties": {"actor_role": {"const": "CONTROLLER"}, "to_state": {"enum": ["READY", "MERGED"]}}, "required": ["actor_role", "to_state"]}, "then": {"required": ["authority_proof_sha256"]}}
      ],
      "oneOf": [
        {"properties": {"from_state": {"const": "PLANNED"}, "to_state": {"enum": ["PREFLIGHT", "HARD_GATE", "ABANDONED"]}}, "required": ["from_state", "to_state"]},
        {"properties": {"from_state": {"const": "PREFLIGHT"}, "to_state": {"enum": ["IMPLEMENTING", "HARD_GATE", "BLOCKED", "NOT_AUDITABLE"]}}, "required": ["from_state", "to_state"]},
        {"properties": {"from_state": {"const": "IMPLEMENTING"}, "to_state": {"enum": ["IMPLEMENTED_DRAFT_PR", "HARD_GATE", "BLOCKED"]}}, "required": ["from_state", "to_state"]},
        {"properties": {"from_state": {"const": "IMPLEMENTED_DRAFT_PR"}, "to_state": {"enum": ["AUDITING", "HARD_GATE", "BLOCKED", "NOT_AUDITABLE"]}}, "required": ["from_state", "to_state"]},
        {"properties": {"from_state": {"const": "AUDITING"}, "to_state": {"enum": ["PASS", "PASS_WITH_COMMENTS", "CHANGES_REQUESTED", "BLOCKED", "NOT_AUDITABLE"]}}, "required": ["from_state", "to_state"]},
        {"properties": {"from_state": {"const": "CHANGES_REQUESTED"}, "to_state": {"enum": ["CORRECTING", "HARD_GATE", "ABANDONED"]}}, "required": ["from_state", "to_state"]},
        {"properties": {"from_state": {"const": "CORRECTING"}, "to_state": {"enum": ["REAUDITING", "HARD_GATE", "BLOCKED"]}}, "required": ["from_state", "to_state"]},
        {"properties": {"from_state": {"const": "REAUDITING"}, "to_state": {"enum": ["PASS", "PASS_WITH_COMMENTS", "CHANGES_REQUESTED", "BLOCKED", "NOT_AUDITABLE"]}}, "required": ["from_state", "to_state"]},
        {"properties": {"from_state": {"const": "PASS"}, "to_state": {"enum": ["FAST_TRACK_ELIGIBLE", "HARD_GATE", "READY", "ABANDONED"]}}, "required": ["from_state", "to_state"]},
        {"properties": {"from_state": {"const": "PASS_WITH_COMMENTS"}, "to_state": {"enum": ["FAST_TRACK_ELIGIBLE", "HARD_GATE", "READY", "ABANDONED"]}}, "required": ["from_state", "to_state"]},
        {"properties": {"from_state": {"const": "FAST_TRACK_ELIGIBLE"}, "to_state": {"enum": ["READY", "HARD_GATE", "BLOCKED", "NOT_AUDITABLE"]}}, "required": ["from_state", "to_state"]},
        {"properties": {"from_state": {"const": "HARD_GATE"}, "to_state": {"enum": ["PREFLIGHT", "IMPLEMENTING", "AUDITING", "CORRECTING", "READY", "BLOCKED", "ABANDONED"]}}, "required": ["from_state", "to_state"]},
        {"properties": {"from_state": {"const": "READY"}, "to_state": {"enum": ["MERGED", "HARD_GATE", "BLOCKED", "NOT_AUDITABLE"]}}, "required": ["from_state", "to_state"]},
        {"properties": {"from_state": {"const": "MERGED"}, "to_state": {"enum": ["POST_MERGE_SYNC", "BLOCKED"]}}, "required": ["from_state", "to_state"]},
        {"properties": {"from_state": {"const": "POST_MERGE_SYNC"}, "to_state": {"enum": ["COMPLETED", "BLOCKED"]}}, "required": ["from_state", "to_state"]}
      ]
    }
  }
}
