{"work_id":"ACA-W002-S02","role":"INDEPENDENT_AUDIT","result_state":"PASS","repository":"landco-llc/agentic-change-audit","branch":"feat/aca-w002","base_sha":"aaaaaaaaaaaaaaaaaaaaaaaaaaaaaaaaaaaaaaaa","target_sha":"bbbbbbbbbbbbbbbbbbbbbbbbbbbbbbbbbbbbbbbb","pr_applicable":true,"pr_number":20,"scope_observation":{"allowed_scope_only":true,"changed_files":["scripts/validate-orchestration.py"]},"checks":[{"name":"test","status":"PASSED","evidence_ref":{"reference":"docs/evidence","proves":"test","observed_at":"2026-08-09T00:00:00Z"}}],"evidence":[{"reference":"docs/evidence","proves":"result","observed_at":"2026-08-09T00:00:00Z"}],"transition":{"work_id":"ACA-W002-S02","recorded_at":"2026-08-09T00:00:00Z","actor_role":"INDEPENDENT_AUDIT","repository":"landco-llc/agentic-change-audit","branch":"feat/aca-w002","base_sha":"aaaaaaaaaaaaaaaaaaaaaaaaaaaaaaaaaaaaaaaa","target_applicable":true,"target_sha":"bbbbbbbbbbbbbbbbbbbbbbbbbbbbbbbbbbbbbbbb","pr_applicable":true,"pr_number":20,"from_state":"AUDITING","to_state":"PASS","reason":"pass","evidence_refs":[{"reference":"docs/evidence","proves":"result","observed_at":"2026-08-09T00:00:00Z"}],"evidence_hashes":["cccccccccccccccccccccccccccccccccccccccccccccccccccccccccccccccc"],"next_permitted_action":"human"},"limitations":[],"next_work":{"action":"HUMAN_GATE","rule":"human"}}
