{"work_id":"ACA-W002-S03","role":"CORRECTION","result_state":"REAUDITING","repository":"landco-llc/agentic-change-audit","branch":"feat/aca-w002","base_sha":"aaaaaaaaaaaaaaaaaaaaaaaaaaaaaaaaaaaaaaaa","target_sha":"bbbbbbbbbbbbbbbbbbbbbbbbbbbbbbbbbbbbbbbb","pr_applicable":false,"scope_observation":{"allowed_scope_only":true,"changed_files":["scripts/validate-orchestration.py"]},"checks":[{"name":"test","status":"PASSED","evidence_ref":{"reference":"docs/evidence","proves":"test","observed_at":"2026-08-09T00:00:00Z"}}],"evidence":[{"reference":"docs/evidence","proves":"result","observed_at":"2026-08-09T00:00:00Z"}],"transition":{"work_id":"ACA-W002-S03","recorded_at":"2026-08-09T00:00:00Z","actor_role":"CORRECTION","repository":"landco-llc/agentic-change-audit","branch":"feat/aca-w002","base_sha":"aaaaaaaaaaaaaaaaaaaaaaaaaaaaaaaaaaaaaaaa","target_applicable":true,"target_sha":"bbbbbbbbbbbbbbbbbbbbbbbbbbbbbbbbbbbbbbbb","pr_applicable":false,"from_state":"CORRECTING","to_state":"REAUDITING","reason":"corrected","evidence_refs":[{"reference":"docs/evidence","proves":"result","observed_at":"2026-08-09T00:00:00Z"}],"evidence_hashes":["cccccccccccccccccccccccccccccccccccccccccccccccccccccccccccccccc"],"next_permitted_action":"audit"},"limitations":[],"next_work":{"action":"NONE","rule":"none"}}
