{"work_id":"ACA-W002-S01","role":"IMPLEMENTATION","result_state":"IMPLEMENTED_DRAFT_PR","repository":"landco-llc/agentic-change-audit","branch":"feat/aca-w002","base_sha":"aaaaaaaaaaaaaaaaaaaaaaaaaaaaaaaaaaaaaaaa","target_sha":"bbbbbbbbbbbbbbbbbbbbbbbbbbbbbbbbbbbbbbbb","pr_applicable":false,"scope_observation":{"allowed_scope_only":true,"changed_files":["scripts/validate-orchestration.py"]},"checks":[{"name":"test","status":"PASSED","evidence_ref":{"reference":"docs/evidence","proves":"test","observed_at":"2026-08-09T00:00:00Z"}}],"evidence":[{"reference":"docs/evidence","proves":"result","observed_at":"2026-08-09T00:00:00Z"}],"transition":{"work_id":"ACA-W002-S01","recorded_at":"2026-08-09T00:00:00Z","actor_role":"IMPLEMENTATION","repository":"landco-llc/agentic-change-audit","branch":"feat/aca-w002","base_sha":"aaaaaaaaaaaaaaaaaaaaaaaaaaaaaaaaaaaaaaaa","target_applicable":false,"pr_applicable":false,"from_state":"IMPLEMENTING","to_state":"IMPLEMENTED_DRAFT_PR","reason":"done","evidence_refs":[{"reference":"docs/evidence","proves":"result","observed_at":"2026-08-09T00:00:00Z"}],"evidence_hashes":["cccccccccccccccccccccccccccccccccccccccccccccccccccccccccccccccc"],"next_permitted_action":"audit"},"limitations":[],"next_work":{"action":"NONE","rule":"none"}}
