{"work_id":"ACA-W002-S04","role":"INDEPENDENT_AUDIT","result_state":"BLOCKED","repository":"landco-llc/agentic-change-audit","branch":"feat/aca-w002","base_sha":"aaaaaaaaaaaaaaaaaaaaaaaaaaaaaaaaaaaaaaaa","target_sha":"bbbbbbbbbbbbbbbbbbbbbbbbbbbbbbbbbbbbbbbb","pr_applicable":false,"scope_observation":{"allowed_scope_only":true,"changed_files":[]},"checks":[{"name":"test","status":"NOT_RUN","evidence_ref":{"reference":"docs/evidence","proves":"blocked","observed_at":"2026-08-09T00:00:00Z"}}],"evidence":[{"reference":"docs/evidence","proves":"result","observed_at":"2026-08-09T00:00:00Z"}],"transition":{"work_id":"ACA-W002-S04","recorded_at":"2026-08-09T00:00:00Z","actor_role":"INDEPENDENT_AUDIT","repository":"landco-llc/agentic-change-audit","branch":"feat/aca-w002","base_sha":"aaaaaaaaaaaaaaaaaaaaaaaaaaaaaaaaaaaaaaaa","target_applicable":false,"pr_applicable":false,"from_state":"AUDITING","to_state":"BLOCKED","reason":"blocked","evidence_refs":[{"reference":"docs/evidence","proves":"result","observed_at":"2026-08-09T00:00:00Z"}],"evidence_hashes":["cccccccccccccccccccccccccccccccccccccccccccccccccccccccccccccccc"],"next_permitted_action":"stop"},"limitations":["blocked"],"next_work":{"action":"NONE","rule":"none"}}
